16047749,Monograph,Language material ; Still image ; Text,Volume,,,9.78848E+12,"Ruiz, Elisa",,person,author,"Madrid (Spain : Region), publisher [organisation] ; Ruiz, Elisa, author [person] ; Leonardo, da Vinci, 1452-1519 [person] ; Canal de Isabel ll (Firm : Madrid, Spain), publisher [organisation]",Claves de una mente prodigiosa : Leonardo Da Vinci,Leonardo Da Vinci,,,Spain,Madrid,Canal de Isabel II ; Comunidad de Madrid,2011,,"299 pages, illustrations (black and white and colour), 26 cm + 1 folded sheet",,YF.2013.b.739,"Leonardo, da Vinci, 1452-1519--Exhibitions ; Leonardo, da Vinci, 1452-1519--Manuscripts--Exhibitions ; Artists--Italy--Biography--Exhibitions",Biography ; Exhibition,Italian ; Latin ; Spanish,"Published on the occasion of an exhibition, 'Da Vinci, el genio,' organized by Canal de Isabel II (Spain), Grande Exhibitions (Australia), the Fundación Anthropos (Italy) and Pascal Cotte (France) ; folded timeline inserted",
16054161,Monograph,Language material ; Text,Volume,GBB229541,,9.78075E+12,"Picknett, Lynn",,person,,"Picknett, Lynn [person] ; Prince, Clive [person]",Turin shroud : how Leonardo Da Vinci fooled history,,,,England,London,Sphere,2012,,"xvi, 332 pages, 20 cm",232.966,,"Leonardo, da Vinci, 1452-1519 ; Holy Shroud",,English,,
16056132,Monograph,Language material ; Still image ; Text,Volume,GBB345776,,9.78071E+12,"Barone, Juliana",,person,author,"Barone, Juliana, author [person] ; British Library, publisher [organisation]",Leonardo da Vinci's notebook : the Codex Arundel,,Treasures in focus,,England,London,British Library,2008,,"64 pages, illustrations (sepia and colour), 12 cm",509.2,YC.2013.a.5934,"Leonardo, da Vinci, 1452-1519",,English,,
16064269,Monograph,Language material ; Text,Volume,,,9.78884E+12,,,,,"Musei capitolini (Rome, Italy) [organisation] ; Leonardo, da Vinci, 1452-1519 [person] ; Marani, Pietro C. [person] ; Ragionieri, Pina [person] ; Michelangelo Buonarroti, 1475-1564 [person]",Leonardo e Michelangelo : capolavori della grafica e studi romani,Capolavori della grafica e studi romani,,,Italy,Cinisello Balsamo ; Milano,Silvana,2011,,"215 pages, illustrations (chiefly colour), facsimiles, 28 cm",,LF.31.b.8386,"Leonardo, da Vinci, 1452-1519--Exhibitions ; Drawing, Italian--15th century--Exhibitions ; Drawing, Renaissance--Italy--Exhibitions ; Drawing, Italian--16th century--Exhibitions ; Michelangelo Buonarroti, 1475-1564--Exhibitions",Exhibition,Italian,"Catalog of an exhibition held at Musei capitolini, Rome, Italy, October 27, 2011-Feb. 12, 2012",
16064555,Monograph,Language material ; Text,Volume,,,9.78884E+12,"Leonardo, da Vinci",1452-1519,person,,"Santa Maria delle Grazie (Church : Milan, Italy) [organisation] ; Biblioteca ambrosiana [organisation] ; Fondazione Cardinale Federico Borromeo [organisation] ; Leonardo, da Vinci, 1452-1519 [person] ; Marani, Pietro C. [person] ; Malipiero, Anna [person]","Fortezze, bastioni e cannoni : disegni di Leonardo dal Codice Atlantico = Fortresses, bastions and cannons : drawings by Leonardo from the Codex Atlanticus","Fortresses, bastions and cannons",Codex Atlanticus,1 [Codex Atlanticus],Italy,Novara,Agostini,2009,,"109 pages, colour illustrations, 21 cm",,YF.2012.a.18164,"Biblioteca ambrosiana--Art collections--Exhibitions ; Codice atlantico--Exhibitions ; Military engineering--Early works to 1800--Exhibitions ; Leonardo, da Vinci, 1452-1519--Notebooks, sketchbooks, etc--Exhibitions",Early works to 1800 ; Exhibition,English ; Italian,"Catalogue of an exhibition held at the Sacrestia deel Bramante nel complesso monumentale delle Grazie and at the Biblioteca-Pinacoteca-Accademia Ambrosiana, Milan, Italy, September 10-Dec. 2, 2009",
16070166,Monograph,Language material ; Text,Volume,,,,"Leonardo, da Vinci",1452-1519,person,,"Leonardo, da Vinci, 1452-1519 [person]",Del moto e misura dell'acqua,Moto e misura dell'acqua ; Raccolta d'autori italiani che trattano del moto dell'acque,,,Italy,Bologna,A spese di F. Cardinali,1828,,"273-450 pages, 51 leaves of plates, illustrations, 30 cm",627,RB.23.b.7276,"Hydraulics--Early works to 1800 ; Hydrodynamics, 15th cent ; Hydrodynamics--Early works to 1800",Early works to 1800,Italian,Original sheets with a new t.p,
16076735,Monograph,Language material ; Text,Volume,GBB242328,,9.78075E+12,"King, Ross",1962-,person,,"King, Ross, 1962- [person]",Leonardo and the Last supper,,,,England,London,Bloomsbury,2012,,"336 pages, 8 pages of plates, illustrations, maps, 24 cm",759.5,YC.2013.a.4968,"Leonardo, da Vinci, 1452-1519 ; Leonardo, da Vinci, 1452-1519--Criticism and interpretation ; Last Supper in art",,English,,
16084491,Monograph,Language material ; Text,Volume,GBB269507,,9.78071E+12,"Emison, Patricia A.",,person,,"Emison, Patricia A. [person]",Leonardo,,Colour library,,England,London,Phaidon,2011,,"126 pages, illustrations (chiefly colour), 31 cm",759.5,YK.2012.b.12429,"Leonardo, da Vinci, 1452-1519--Criticism and interpretation",,English,,
16091594,Monograph,Language material ; Still image ; Text,Volume,GBB250628,,9.78887E+12,"Carminati, Marco",,person,author,"Carminati, Marco, author [person]",Leonardo : Mona Lisa,,Art mysteries,,Italy,Milan,24 ORE Cultura,2012,First edition,"79 pages, colour illustrations, 22 cm",759.5,YC.2015.a.5486,"Leonardo, da Vinci, 1452-1519",,English,,
16095713,Monograph,Language material ; Still image ; Text,Volume,GBB253329,,9782350313870 ; 9788897737025,,,,,"Delieuvin, Vincent, editor [person]",Saint Anne : Leonardo da Vinci's ultimate masterpiece,,,,Italy,Milano,Libraria,2012,,"444 pages, illustrations (black and white and colour), 29 cm",759.5,LC.31.b.12263,"Leonardo, da Vinci, 1452-1519--Exhibitions",Exhibition,English,,
16112769,Monograph,Language material ; Text,Volume,,,9.78849E+12,Biblioteca Nacional (Spain),,organisation,,"Ruiz, Elisa [person] ; Biblioteca Nacional (Spain) [organisation] ; Leonardo, da Vinci, 1452-1519 [person] ; Guadalupe, María José [person]",El imaginario de Leonardo : Códices Madrid de la BNE,,,,Spain,Madrid,Biblioteca Nacional de España,2012,,"341 pages, colour illustrations, 26 cm",,YF.2012.b.2388,"Manuscripts, Italian--Spain--Madrid--Exhibitions ; Manuscritos--Exposiciones ; Leonardo da Vinci (1452-1519)--Manuscritos--Exposiciones ; Leonardo, da Vinci, 1452-1519--Notebooks, sketchbooks, etc--Exhibitions ; Leonardo, da Vinci, 1452-1519--Exhibitions ; Biblioteca Nacional (Spain)--Exhibitions",Exhibition,Spanish,"Catalogue of an exhibition at the Biblioteca Nacional de España, Madrid, 29 May-29 July 2012",
16113219,Monograph,Language material ; Still image ; Text,Volume,GBB378039,,9.78191E+12,"Clayton, Martin",1967-,person,author,"Clayton, Martin, 1967-, author [person] ; Leonardo, da Vinci, 1452-1519 [person] ; Stephenson, Johanna, editor [person]",Ten drawings by Leonardo da Vinci : a Diamond Jubilee celebration,Diamond Jubilee Celebration ; Drawings,,,England,London,Royal Collection Publications,2012,,"45 pages, illustrations (black and white and colour), 29 cm",741.945,YK.2013.b.7340,"Leonardo, da Vinci, 1452-1519--Exhibitions ; Drawing--Private collections--England--Windsor (Berkshire)--Exhibitions ; Elizabeth--II, Queen of Great Britain, 1926---Art collections--Exhibitions",Exhibition,English,This catalogue accompanies an exhibition organised by the Royal collection to celebrate the Diamond Jubilee of Her Majesty The Queen in 2012,
16121318,Monograph,Language material ; Text,Volume,GBB266770,,9.78096E+12,"Wells, Michael",1965 November 17-,person,,"Wells, Michael, 1965 November 17- [person]",Davinci-- decoded :- : redrum,aclavinci--clecoded : redrum,,,England,Hebburn,Artisanine,2010,,"60 leaves, 60 colour illustrations, 30 cm",,,"Leonardo, da Vinci, 1452-1519 ; Conceptual art",,English,,
16128379,Monograph,Language material ; Text,Volume,,,9.78607E+12,"Ioanid, Ileana",,person,,"Ioanid, Ileana [person]",Fata cu pistrui : schiţe şi povestiri,,,,Romania,Craiova,Scrisul Românesc,2012,,"295, 1 page, 21 cm",,YF.2012.a.25203,"Leonardo, da Vinci, 1452-1519 ; Short stories, Romanian--21st century",,Romanian,,
16132872,Monograph,Language material ; Still image ; Text,Volume,,,9788895686226 ; 9788895686332,"Taglialagamba, Sara",,person,author,"Taglialagamba, Sara, author [person]",Leonardo & engineering,Leonardo and engineering,,,Italy,Poggio a Caiano,,2010,,"151 pages, illustrations (black and white and colour), 18 cm",,YD.2013.a.3726,"Leonardo, da Vinci, 1452-1519--Knowledge--Engineering",,English,Translated from the Italian,
16134827,Monograph,Language material ; Text,Volume,,,9.78884E+12,"Occhipinti, Carmelo",,person,,"Occhipinti, Carmelo [person]","Leonardo da Vinci e la corte di Francia : fama, exfrasi, stile",,Biblioteca di testi e studi,632 [Biblioteca di testi e studi],Italy,Roma,Carocci,2011,1st edition,"206 pages, illustrations, 22 cm",,YF.2012.a.27433,"Leonardo, da Vinci, 1452-1519--Criticism and interpretation ; Fontainebleau school of art ; Francis--I, King of France, 1494-1547--Art patronage ; France--Court and courtiers",,Italian,,
16163858,Monograph,Language material ; Text,Volume,GBB289404,,9.78881E+12,"Cremante, Simona",,person,,"Cremante, Simona [person]",Leonardo da Vinci : artist - scientist - inventor,,,,England ; Italy,Brighton ; Firenze,Giunti ; Roundhouse,2012,,"1 volume, illustrations (some colour), 27 cm",759.5,,"Leonardo, da Vinci, 1452-1519 ; Artists--Italy--Biography",Biography,English,,
16178985,Monograph,Language material ; Text,Volume,,,9.7889E+12,,,,,"Accademia di belle arti (Milan, Italy) [organisation] ; Salvi, Paola [person]","Approfondimenti sull'uomo vitruviano di Leonardo da Vinci : atti delle giornate di studi, Accademia di belle arti di Brera, Sala napoleonica, 9 febbraio 2010, 4-5 maggio 2011",,,,Italy,Poggio a Caiano,,2012,,"256 pages, illustrations (some colour), 24 cm",,YF.2012.a.32064,"Human figure in art--Congresses ; Architectural drawing, Renaissance--Congresses ; Proportion (Art)--Congresses ; Leonardo, da Vinci, 1452-1519--Congresses ; Vitruvius Pollio--Influence--Congresses",Congress,Italian,"At head of t.p.: Accademia di belle arti di Brera, Milano",
16180691,Monograph,Language material ; Text,Volume,,,9.78882E+12,"Giornata Valéry-Leonardo, Vinci, Italy",2007,meeting/conference,,"Nanni, Romano [person] ; Giornata Valéry-Leonardo, Vinci, Italy, 2007 [meeting/conference] ; Sanna, Antonietta [person] ; Institut des textes et manuscrits modernes (Centre national de la recherche scientifique (France)) [organisation]","Leonardo da Vinci : interpretazioni e rifrazioni tra Giambattista Venturi e Paul Valéry : atti della 'Giornata Valéry-Leonardo,' promossa dall'Équipe Valéry dell'Institut des textes et manuscrits modernes, CNRS, Parigi, dall'Università di Pisa e dalla Biblioteca leonardiana, Vinci, 18 maggio 2007",,Biblioteca leonardiana. Studi e documenti,2 [Biblioteca leonardiana. Studi e documenti],Italy,Firenze,L. S. Olschki,2012,,"xiv, 191 pages, illustrations (chiefly colour), 24 cm",,YF.2012.a.32455,"Venturi, Giovanni Battista, 1746-1822--Congresses ; Leonardo, da Vinci, 1452-1519--Influence--Congresses ; France--Civilization--19th century--Congresses ; France--Civilization--20th century--Congresses ; Valéry, Paul, 1871-1945--Congresses",Congress,Italian,,
16181025,Monograph,Language material ; Text,Volume,,,9.78881E+12,"Vecce, Carlo",,person,,"Vecce, Carlo [person] ; Leonardo, da Vinci, 1452-1519 [person] ; Biblioteca leonardiana [organisation]","Le battaglie di Leonardo : Codice A, ff. 111r e 110v : modo di figurare una battaglia",,Lettura vinciana,51 [Lettura vinciana],Italy,Firenze ; Vinci,"Comune di Vinci, Biblioteca Leonardiana ; Giunti",2012,,"32 pages, 8 pages of plates, illustrations, 29 cm",,YF.2012.b.2446,"Leonardo, da Vinci, 1452-1519--Notebooks, sketchbooks, etc ; Battles in art",,Italian,"'LI, Lettura vinciana, 16 aprile 2011, Città di Vinci, Biblioteca leonardiana.'",
16182552,Monograph,Language material ; Text,Volume,GBB299931,,9.78162E+12,"Barsony, Piotr",1946-,person,,"Barsony, Piotr, 1946- [person]",The stories of the Mona Lisa : an imaginary museum tale about the history of modern art,,,,England ; United States of America,London ; New York,Constable & Robinson ; Sky Pony,2013,,"1 volume, 23 cm",759.06,,"Leonardo, da Vinci, 1452-1519--Juvenile literature ; Painting, Modern--Juvenile literature ; Art movements--Juvenile literature",Children's literature,English,,
16200527,Monograph,Language material ; Text,Volume,GBB2B0538,,9.78881E+12,,,,,,The mind of Leonardo : the univeral genius at work,,,,England ; Italy,Brighton ; Firenze,Giunti ; Roundhouse,2012,,"1 volume, illustrations (some colour), 29 cm",709.2,,"Leonardo, da Vinci, 1452-1519--Criticism and interpretation",,English,,
16201557,Monograph,Language material ; Still image ; Text,Volume,,,9.7889E+12,"Melani, Margherita",,person,author,"Leonardo, da Vinci, 1452-1519 [person] ; Melani, Margherita, author [person]",Il fascino dell'opera interrotta : La Battaglia di Anghiari di Leonardo da Vinci,,,,Italy,Poggio a Caiano,,2012,,"127 pages, illustrations (chiefly colour), 18 cm",,YF.2012.a.32291,"Leonardo, da Vinci, 1452-1519--Catalogs ; Leonardo, da Vinci, 1452-1519--Criticism and interpretation ; Artists' preparatory studies--Catalogs",Catalogue,Italian,,
16204420,Monograph,Language material ; Text,Volume,,,9.78884E+12,"Manenti Valli, Franca",,person,,"Manenti Valli, Franca [person]",Leonardo : il comporre armonico nella tavola dell'Annunciazione,,,,Italy,"Cinisello Balsamo, Milano",Silvana,2012,,"205 pages, illustrations (chiefly colour), 22 cm",,YF.2012.a.32387,"Leonardo, da Vinci, 1452-1519--Criticism and interpretation ; Mary, Blessed Virgin, Saint--Annunciation--Art",,English ; German ; Italian,,
16206230,Monograph,Language material ; Text,Volume,GBB2B2575,,9.7889E+12,"Melani, Margherita",,person,,"Melani, Margherita [person]",The fascination of the unfinished work : 'the Battle of Anghiari' by Leonardo Da Vinci,,,,Italy,Oxford ; Poggio a Caiano,Oxbow,2012,,"1 volume, colour illustrations",759.5,,"Leonardo, da Vinci, 1452-1519",,English,,
16219955,Monograph,Language material ; Text,Volume,GBB2C0398,,9781780890944 ; 9781780890975,"Ennis, Michael",,person,,"Ennis, Michael [person]",The malice of fortune,,,,England,London,Century,2013,,"xv, 396 pages, map, 24 cm",813.6,Nov.2013/2570,"Alexander--VI, Pope, 1431-1503--Fiction ; Italy--History--16th century--Fiction ; Machiavelli, Niccolò, 1469-1527--Fiction ; Leonardo, da Vinci, 1452-1519--Fiction",Detective and mystery fiction ; Fiction,English,,
16235039,Monograph,Language material ; Text,Volume,,,,,,,,"Israel, Miśrad ha-ḥinukh ṿeha-tarbut [organisation]",Leʾonardo da Ṿints'i : rishumim,ליאונרדו דא וינצ'י : רישומים,,,Israel,Yerushalayim ; ירושלים,Miśrad ha-Ḥinukh ṿeha-tarbut,1966,,"8 pages, illustrations, 24 cm",,YP.2013.b.13,"Leonardo, da Vinci, 1452-1519 ; Art--Exhibitions--Izrael",Exhibition,Hebrew,Cover title,
16241135,Monograph,Language material ; Text,Volume,,,9.78886E+12,"Antonioli Ferranti, Giorgio",,person,author,"Antonioli Ferranti, Giorgio, author [person]","Il rapace in fuga : Leonardo, Verrocchio e il Battesimo di Cristo",,I grani,,Italy,Firenze,Polistampa,2012,,"93 pages, illustrations (black and white and colour), 17 cm",,YF.2013.a.10925,"Verrocchio, Andrea del, 1435?-1488 ; Leonardo, da Vinci, 1452-1519",,Italian,,
16251110,Monograph,Language material ; Text,Volume,GBB391398,,9.78148E+12,"McQuade, Brian Thom",,person,,"McQuade, Brian Thom [person]","Seven painters who changed the course of art history : Masaccio, Mantegna, Leonardo da Vinci, Bruegal the Elder, Caravaggio, William Hogarth, Goya",,,,United States of America,"Bloomington, Indiana",AuthorHouse,2012,,"174 pages, illustrations (black and white and colour), 28 cm",709.22,YK.2013.b.8614,Painters--Biography ; Painting--History,Biography,English,,
16251193,Monograph,Language material ; Text,Volume,GBB338240,,9.78144E+12,"Lester, Toby",,person,,"Lester, Toby [person] ; Leonardo, da Vinci, 1452-1519 [person]","Da Vinci's ghost : genius, obsession, and how Leonardo created the world in his own image","Genius, obsession, and how Leonardo created the world in his own image",,,United States of America,New York,Free Press,2012,1st Free press hardcover edition,"xv, 275 pages, 8 pages of plates, illustrations (some colour), 24 cm",741.092,YD.2013.a.1012,"Leonardo, da Vinci, 1452-1519 ; Leonardo, da Vinci, 1452-1519--Criticism and interpretation",,English,,
16259753,Monograph,Language material ; Text,Volume,,,,,,,,"Archimedes [person] ; Ferroni, Pietro, 1745-1825 [person] ; Guglielmini, Domenico, 1655-1710 [person] ; Perelli, Tommaso, 1704-1783 [person] ; Leonardo, da Vinci, 1452-1519 [person] ; Manfredi, Eustachio, 1674-1739 [person] ; Montanari, Geminiano, 1633-1687 [person] ; Michelini, Famiano, approximately 1592-1666 [person] ; Zendrini, Bernardino, 1679-1747 [person] ; Boscovich, Ruggero Giuseppe, 1711-1787 [person] ; Grandi, Guido, 1671-1742 [person] ; Albizi, Lorenzo [person] ; Cardinali, Francesco [person] ; Lecchi, Antonio, 1702-1776 [person] ; Viviani, Vincenzio, 1622-1703 [person] ; Great Britain, Patent Office, Library [organisation] ; Narducci, Tommaso, 1679-1766 [person] ; Borelli, Giovanni Alfonso, 1608-1679 [person] ; Ximenes, Leonardo, 1716-1786 [person] ; Zanotti, Eustachio, 1709-1782 [person] ; Galilei, Galileo, 1564-1642 [person] ; Castelli, Benedetto, 1577 or 1578-1643 [person] ; Chiesa, Andrea [person] ; Poleni, Giovanni, 1683-1761 [person] ; J. B. D. G. D. G. [person] ; Gambarini, Bernardo [person] ; Torricelli, Evangelista, 1608-1647 [person] ; Bacialli, Giovanni [person]",Raccolta d'autori italiani che trattano del moto dell'acque,"Della natura de' fiumi ; Delle acque correnti ; Opere idrauliche ; Opuscoli idraulici ; Raccolta sul moto delle acque ; Relazione per la diversione de' fiumi Ronco e Montone dalla città di Ravenna ; Scritture e relazioni sopra la bonificazione della Chiana ; Serie di scritture, e relazioni concernenti il regolamento delle acque delle tre provincie di Bologna, Ferrara, e Romagna ; Trattato delle cose che stanno sul liquido ; Trattato sul moto e misura dell'acque",,,Italy,Bologna,dalla tipografia di Jacopo Marsigli,1821-1826,"Edizione quarta, arricchita di molte cose inedite, e d'alcuni schiarimenti","10 volumes, plates, illustrations (lithographs), maps (lithographs), 27 cm (4°)",,RB.23.b.7369,Hydraulics--Early works to 1800 ; Hydraulic engineering--Early works to 1800 ; Hydrodynamics--Early works to 1800,Early works to 1800,Italian,"Dedications by Francesco Cardinali to: Alexander I of Russia in v. 1; Vincenzo Berni degli Antoni in v. 5; Luigi Salina in v. 7 ; T. 10 has publisher statement: Dalla tipografia Cardinali e Frulli ; T. 1: 1821; t. 2: 1822; t. 3: 1822; t. 4: 1822; t. 5: 1822; t. 6: 1823; t. 7: 1823; t. 8: 1823; t. 9: 1824; t. 10: 1826 ; T. 1: [8], xiv, 366 p, 13 folded leaves of plates; t. 2: [6], 360 p, 4 folded leaves of plates; t. 3: 452 p, 4 folded leaves of plates; t. 4: 495 p, 7 folded leaves of plates; t. 5: lxii, 440 p, 3 folded leaves of plates; t. 6: 539 p, 2 folded leaves of plates; t. 7: 550 p, [2] leaves of plates; t. 8: xxiii, 432 p, 11, [1] folded leaves of plates; t. 9: 559 p.; t. 10: vii, [53] leaves of plates, of which 5 folded ; T. 8: Errata on p. 431-432 ; The name of the lithograph engraver appears on each of the leaves of plates; engravers are: Giuseppe Ferri, Agostino Nini, Officina litografica di Carlo Bertinazzi ; volume 1. Introductory note to this edition signed by the editor, Francesco Cardinali",
16272999,Monograph,Language material ; Text,Volume,GBB346745,,9.78019E+12,"Raynham, Alex",,person,author,"Raynham, Alex, author [person]",Leonardo da Vinci,,Oxford bookworms library. Factfiles,,England,Oxford,Oxford University Press,2013,Simplified edition,"56 pages, illustrations (chiefly colour), 22 cm",,,"Painters--Italy--Biography--Juvenile literature ; Leonardo, da Vinci, 1452-1519--Juvenile literature ; Scientists--Italy--Biography--Juvenile literature",Biography ; Children's literature,English,Also published as a complete recording on CD,
16280722,Monograph,Language material ; Still image ; Text,Volume,GBB315895,,9.78178E+12,"McLaren, Fiona",,person,author,"McLaren, Fiona, author [person]",Da Vinci's last commission : the most sensational detective story in the history of art,,,,Scotland,Edinburgh,Mainstream,2013,,"1 volume, black and white illustrations, 20 cm",759.5,,"Leonardo, da Vinci, 1452-1519 ; Christian heresies--History ; Painting, Renaissance--Italy--Attribution",,English,Originally published: 2012,
16282021,Monograph,Language material ; Text,Volume,,,,,,,,"Bohusz-Szyszko, Marian, 1901-1995 [person]",Leonardo da Vinci : w 500-lecie urodzin,,,,United Kingdom,"Tonbridge Wells, Kent",Poetów i Malarzy,1953,,"83 pages, black and white illustrations, 21 cm",,YF.2013.a.6816,"Leonardo, da Vinci, 1452-1519--Criticism and interpretation",,Polish,Mounted illustrations,
16303847,Monograph,Language material ; Still image ; Text,Volume,GBB326948,,9.78142E+12,"January, Brendan",1972-,person,author,"January, Brendan, 1972-, author [person]",Leonardo da Vinci : Renaissance painter,,People of importance,,United States of America,"Broomall, Pennsylvania",Mason Crest,2013,,"1 volume, illustrations, 28 cm",759.5,,"Painters--Italy--Biography--Juvenile literature ; Leonardo, da Vinci, 1452-1519--Juvenile literature",Biography ; Children's literature,English,,
16309229,Monograph,Language material ; Text,Volume,,,9.78273E+12,,,,,"Museo nazionale della scienza e della tecnica 'Leonardo da Vinci' [organisation] ; Boucheron, Patrick, editor [person] ; Giorgione, Claudio, editor [person] ; Leonardo, da Vinci, 1452-1519, artist [person] ; Cité des sciences et de l'industrie (La Villette, Paris, France) [organisation]",Leonard de Vinci : la nature et l'invention,"Léonard de Vinci, projets, dessins, machines ; Works",,,France,Paris,Universcience éditions ; Éditions de La Martinière,2012,,"191 pages, illustrations, 25 x 29 cm",,LF.31.a.5752,"Leonardo, da Vinci, 1452-1519--Knowledge--Science--Exhibitions ; Leonardo, da Vinci, 1452-1519--Knowledge--Bionics--Exhibitions ; Mechanical engineering--History--Exhibitions ; Bionics--History--Exhibitions ; Leonardo, da Vinci, 1452-1519--Exhibitions ; Leonardo, da Vinci, 1452-1519--Knowledge--Mechanical engineering--Exhibitions ; Drawing, Italian--15th century--Exhibitions ; Robots--Design and construction--Exhibitions",Exhibition,French,"Catalog of an exhibition titled: Léonard de Vinci, projets, dessins, machines, held at Cité des sciences et de l'industrie, Paris, France, 23 October 2012-18 August 2013, in partnership with Museo nazionale della scienza e della tecnica 'Leonardo da Vinci.'",
16316062,Monograph,Language material ; Text,Volume,GBB336156,,9.78042E+12,"Freud, Sigmund",1856-1939,person,author,"Dyson, Alan, translator [person] ; Freud, Sigmund, 1856-1939, author [person]",Leonardo da Vinci : a memory of his childhood,Kindheitserinnerung des Leonardo da Vinci. English,Routledge Great Minds,,England,London,Routledge,2014,,"xv, 97 pages, illustrations, 20 cm",759.5,YK.2014.a.11473,"Leonardo, da Vinci, 1452-1519 ; Psychoanalysis--Case studies",,English,This translation first published: 1957 ; Translated from the German,
16317921,Monograph,Language material ; Still image ; Text,Volume,GBB338015,,9.78883E+12,"Zecchini, Maurizio",,person,author,"Leonardo, da Vinci, 1452-1519 [person] ; Zecchini, Maurizio, author [person]",Leonardo and Salai,Works,,,Italy,Venice,Marsilio,2013,,"1 volume, colour illustrations, 27 cm",759.5,,"Leonardo, da Vinci, 1452-1519",,English,,
16329480,Monograph,Language material ; Still image ; Text,Volume,GBB344277,,9.78191E+12,"Clayton, Martin",1967-,person,author,"Philo, Ronald, author [person] ; Clayton, Martin, 1967-, author [person] ; Royal Collection Trust [organisation]",Leonardo da Vinci : the mechanics of man,Mechanics of man,,,England,London,Royal Collection Trust,2013,,"160 pages, colour illustrations, 31 cm",743.49,YC.2014.b.988,"Anatomy, Artistic ; Leonardo, da Vinci, 1452-1519 ; Windsor (Royal house), 1917-, Great Britain--Art collections",,English,First published: 2010,
16329526,Monograph,Language material ; Still image ; Text,Volume,GBB344323,,9781908973771 ; 9781908973788,"Morley, Jacqueline",,person,author,"Antram, David, 1958-, illustrator [person] ; Salariya, David [person] ; Morley, Jacqueline, author [person]",Avoid being Leonardo Da Vinci!,,The danger zone,,England,Brighton,Book House,2014,,"32 pages, illustrations (black and white and colour), 25 cm",709.2,YK.2014.a.11891,"Artists--Italy--Biography--Juvenile literature ; Leonardo, da Vinci, 1452-1519--Juvenile literature ; Scientists--Italy--Biography--Juvenile literature",Biography ; Children's literature,English,Includes index,
16335300,Monograph,Language material ; Still image ; Text,Volume,GBB346048,,9.78145E+12,,,,,"Wells, F. C., author [person] ; Leonardo, da Vinci, 1452-1519 [person]",The heart of Leonardo,Works,,,England,Heidelberg,Springer,2013,,"xxii, 256 pages, illustrations, 29 cm",741.092,YK.2014.b.5287,"Leonardo, da Vinci, 1452-1519--Knowledge--Anatomy ; Leonardo, da Vinci, 1452-1519--Criticism and interpretation ; Heart",,English,,
16340756,Monograph,Language material ; Text,Online resource,,,,,,,,"Directorate-General for Education, Training and Youth [organisation] ; European Commission [organisation]",Leonardo da Vinci : Action programme for the implementation of a European Community vocational training policy 1995-99,,,,Luxembourg,,OPOCE,1996,,1 online resource,,,education policy ; technical education ; continuing education ; vocational training ; action programme,,English,,
