5579298,Monograph,Language material ; Text,Volume,GB6917589,,9.78071E+12,"Leonardo, da Vinci",1452-1519,person,,"Leonardo, da Vinci, 1452-1519 [person] ; Pedretti, Carlo [person] ; Clark, Kenneth, 1903-1983 [person]",The drawings of Leonardo da Vinci in the collection of Her Majesty the Queen at Windsor Castle,,The Italian drawings at Windsor Castle,,England,London,Phaidon,1968,,"2, lxvii, 220 pages, 31 cm",740.924,,"Leonardo, da Vinci, 1452-1519 ; Windsor Castle--Royal Library ; Windsor (Royal house), 1917-, Great Britain--Art collections",,English,"Previous edition published in 2 volume as 'A catalogue of the drawings of Leonardo da Vinci in the collection of His Majesty the King at Windsor Castle'. Cambridge: Cambridge U.P, 1935",
5579299,Monograph,Language material ; Text,Volume,GB6917590,,9.78071E+12,"Leonardo, da Vinci",1452-1519,person,,"Leonardo, da Vinci, 1452-1519 [person] ; Pedretti, Carlo [person] ; Clark, Kenneth, 1903-1983 [person]",The drawings of Leonardo da Vinci in the collection of Her Majesty the Queen at Windsor Castle,,The Italian drawings at Windsor Castle,,England,London,Phaidon,1969,,"320 pages of illustrations, 31 cm",740.924,,Windsor Castle--Royal Library,,English,"Previous edition published in 2 volume as 'A catalogue of the drawings of Leonardo da Vinci in the collection of His Majesty the King at Windsor Castle'. Cambridge: Cambridge U.P, 1935",
5579304,Monograph,Language material ; Text,Volume,GB6926419,,9.78071E+12,"Leonardo, da Vinci",1452-1519,person,,"Leonardo, da Vinci, 1452-1519 [person] ; Pedretti, Carlo [person] ; Clark, Kenneth, 1903-1983 [person]",The drawings of Leonardo da Vinci in the collection of Her Majesty the Queen at Windsor Castle,,The Italian drawings at Windsor Castle,,England,London,Phaidon,1969,"2nd edition, revised with the assistance of Carlo Pedretti, in 3vols","xiii, 57 pages, 58-241 pages of illustrations, facsimiles, plan, 242-277 pages, 31 cm",741.0924,,"Leonardo, da Vinci, 1452-1519",,English,"Previous edition published in 2vols as 'A catalogue of the drawings of Leonardo da Vinci in the collection of His Kajesty the King at Windsor Castle'. Cambridge: Cambridge U.P, 1935",
5675643,Monographic component part,Language material ; Text,Volume,,,,"Cable, Carole",,person,,"Cable, Carole [person]",Leonardo da Vinci : architect and urban planner,,,,,,Vance Bibl,1981,,,,9143.987,,,English,,
5716505,Monographic component part,Language material ; Text,Volume,,,,"Leonardo, da Vinci",1452-1519,person,,"Leonardo, da Vinci, 1452-1519 [person] ; Marinoni, Augusto, editor [person] ; Cogliati Arano, Luisa, editor [person]",Leonardo All'Ambrosiana : il codice atlantico i disegni di Leonardo e della sua cerchia,,,,,Milano,Electa,1982,,,,3976.66,,,Italian,,
5789749,Monographic component part,Language material ; Text,Volume,,,,,,,,,ELECTROSTATIC AND ELECTROMAGNETIC CONFINEMENT OF PLASMAS AND THE PHENOMENOLOGY OF RELATIVISTIC ELECTRON BEAMS- PAPERS PRESENTED AT A CONFERENCE- NEW YORK ACADEMY OF SCIENCES- LEONARDO DA VINCI ACADEMY OF ARTS AND SCIENCES,,,,,,,,,,,1031,PHENOMENOLOGY ; PLASMAS ; ELECTROMAGNETIC CONFINEMENT ; SCIENCES ; RELATIVISTIC ELECTRON BEAMS ; ELECTROSTATIC,,English,,
6078917,Monograph,Language material ; Text,Volume,,,,,,,,Amministrazione Comunale di Ro Ferrarese [organisation] ; Scuola Media 'Leonardo da Vinci' [organisation],Riccardo Bacchelli e il 'Mulino del Po' : la parola e l'immagine : Convegno di studi : Papers,,,,,Ferrara,Liberty House,1987,,,,X20-9846,Bacchelli ; mulino ; parola ; Po,,Italian,,
6114807,Monographic component part,Language material ; Text,Volume,,,9.789E+12,"Farago, Claire J.",,person,,"Leonardo, da Vinci, 1452-1519 [person] ; Farago, Claire J. [person]",Leonardo da Vinci's Paragone : a critical interpretation with a new edition of the text in the Codex Urbinas,,,,Netherlands ; United States of America,Leiden ; New York,E.J. Brill,1991,,,,2284.13,,,English,,
6249408,Monograph,Language material ; Text,Volume,,,9.78093E+12,,,,,"Ahl, Diane Cole, editor [person]",Leonardo da Vinci's Sforza monument horse : the art and the engineering : Symposium : Papers,,,,,,Lehigh University Press,1995,,152 pages,,f96/0008,Sforza monument horse ; Leonardo da Vinci,,English,,
6354476,Monograph,Language material ; Text,Volume,,,9.78092E+12,"Dilts, Robert B.",,person,,"Dilts, Robert B. [person]",Strategies of genius,,,,United States of America,"Capitola, California",Meta Publications,1995,,"xii, 415 pages, illustrations, portraits, 24 cm",,96/32782,,,English,,
6382721,Monograph,Language material ; Text,Volume,,,9.7819E+12,"Leonardo da Vinci Transition Measures Conference, Ennis, Co. Clare",1995,meeting/conference,,"Leonardo da Vinci Transition Measures Conference, Ennis, Co. Clare, 1995 [meeting/conference]",Leonardo da Vinci transition measures conference : an open & distance learning approach to enterprise training,,,,Ireland,Shannon,"Curriculum Development Centre, St. Patrick's Comprehensive School",1996,,"vi, 106 pages, 30 cm",,q97/11473,enterprise training ; Distance education--Congresses ; Leonardo da Vinci ; distance learning ; open learning ; Curriculum planning--Congresses ; Unemployed--Training of--Europe--Congresses,,English,,
6480858,Monographic component part,Language material ; Text,Volume,,,9.78928E+12,,,,,European Commission [organisation],Leonardo da Vinci : Impact Compendium,,,,Luxembourg,,European Commission,1998,1998th edition,"vii, 106 pages",370.113094,5182.610000 ; EU370.113094,,,English,,
6576080,Monographic component part,Language material ; Text,Volume,,,9780789201560 ; 9780896601017,"Clayton, Martin",1967-,person,,"Royal Library (Windsor Castle) [organisation] ; Clayton, Martin, 1967- [person] ; Leonardo, da Vinci, 1452-1519 [person] ; Queen's Gallery (London, England) [organisation]",Leonardo da Vinci : a singular vision,,,,England ; United States of America,London ; New York,Abbeville Press ; Merrell Holberton,1996,,"168 pages, illustrations (some colour), maps (some colour), portraits, 29 cm",741.945,m01/30483,"Leonardo, da Vinci, 1452-1519--Exhibitions ; Anatomy, Artistic--Exhibitions ; Drawing--Private collections--England--Windsor (Berkshire)--Exhibitions ; Elizabeth--II, Queen of Great Britain, 1926---Art collections--Exhibitions",,English,,
6612312,Monograph,Language material ; Text,Volume,,,9.78981E+12,"Superconducting materials; advances in technology and applications (Summer course), Bologna, Italy",1998,meeting/conference,,"Cellotti, G., editor [person] ; Kitazawa, K. [person] ; Research Institute for Ceramics Technology, France [organisation] ; Tampieri, A., editor [person] ; Consiglio nazionale delle ricerche (Italy), Scientific Research Area, Bologna [organisation] ; Superconducting materials; advances in technology and applications (Summer course), Bologna, Italy, 1998 [meeting/conference]",Superconducting materials : advances in technology and applications: International Advanced School Leonardo Da Vinci,,,,Singapore,,World Scientific,2000,,,,m02/32445,applications ; superconducting materials ; technology,,English,,
6658404,Monographic component part,Language material ; Text,Volume,GBA567988,,9780773465640 ; 9780889463257,"Parr, Adrian",,person,,"Parr, Adrian [person]",Exploring the work of Leonardo da Vinci within the context of contemporary philosophical thought and art,From Bergson to Deleuze,Problems in contemporary philosophy,volume 55 [Problems in contemporary philosophy],United States of America,"Lampeter ; Lewiston, New York",Edwin Mellen,2003,,"viii, 220 pages, illustrations, 24 cm",709.2,6617.879700 ; YC.2005.a.6356,"Leonardo, da Vinci, 1452-1519--Criticism and interpretation ; Art--Philosophy ; Leonardo, da Vinci, 1452-1519--Influence ; Leonardo, da Vinci, 1452-1519--Aesthetics",,English,,
6662376,Monograph,Language material ; Text,Computer disc,,,9.7819E+12,,,,,"International Association of Fish Inspection, Eu Leonardo da Vinci Project [organisation] ; World fish inspection and quality control congress (4th) [meeting/conference]",Building effective traceability systems : a risk based approach,,,,England,,Mike Dillon Associates,2001,,,,Vm04/50055,building effective systems ; traceability systems ; fish inspection ; quality control,,English,,
6675009,Monograph,Language material ; Text,Volume,,,,"Leonardo, da Vinci",1452-1519,person,,"Leonardo, da Vinci, 1452-1519 [person] ; Govi, Gilberto, 1826-1889 [person] ; Poli Capri, Paola [person] ; Istituto di Francia [organisation]","Leonardo da Vinci, i manoscritti dell'Istituto di Francia",,,,Italy,Roma,H.B. van der Poel,2000,,"10 volumes (various pagings), illustrations, 30 cm",91,YA.2001.b.1642,"Manuscripts, Italian ; Leonardo, da Vinci, 1452-1519--Manuscripts",Manuscript,Italian,,
6675528,Monograph,Language material ; Text,Volume,,,9.78881E+12,"Leonardo, da Vinci",1452-1519,person,,"Marinoni, Augusto [person] ; Biblioteca ambrosiana [organisation] ; Leonardo, da Vinci, 1452-1519 [person]",Il codice atlantico della Biblioteca ambrosiana di Milano,Codice atlantico,,,Italy,Firenze,Giunti,2000,,"3 volumes (x, 2000 pages), illustrations, 34 cm",,LB.31.c.12641,"Manuscripts, Italian--Italy--Milan--Facsimiles ; Leonardo, da Vinci, 1452-1519 ; Mechanical engineering--Early works to 1800 ; Biblioteca ambrosiana. Manuscript. Codice atlantico",Early works to 1800 ; Facsimile,Italian,,
6675823,Monograph,Language material ; Text,Sheet,,,,"Leonardo, da Vinci",1452-1519,person,,"Leonardo, da Vinci, 1452-1519 [person]",Codice Leicester,Codex Leicester,,,Italy,Napoli,A.E.S. Art,2001,,"1 portfolio, illustrations, 33 cm",,RF.2002.c.5,"Manuscripts, Italian--Washington (State)--Seattle ; Hydraulics--Early works to 1800 ; Hydrodynamics--Early works to 1800",Early works to 1800,Italian,In box ; Title from box,
6676802,Monograph,Language material ; Text,Volume,,,,"Leonardo, da Vinci",1452-1519,person,,"Institut de France [organisation] ; Leonardo, da Vinci, 1452-1519 [person] ; Venerella, John [person]",The manuscripts of Leonardo da Vinci in the Institut de France,"Works. Selections. English, 1999",,,Italy,Milano,Ente raccolta vinciana,1999,,"volumes, illustrations, 24 cm",509.024,YA.2002.a.36102,Science--Early works to 1800,Early works to 1800,English ; Latin,,
6697610,Monograph,Language material ; Text,Volume,,,9.78528E+12,"Merezhkovsky, Dmitry Sergeyevich",1865-1941,person,,"Merezhkovsky, Dmitry Sergeyevich, 1865-1941 [person]",Khristos i Antikhrist : trilogii︠a︡ v dvukh tomakh,Antikhrist ; Smertʹ bogov ; Voskresshie bogi,Zhivai︠a︡ proza istorii,,Russia,Moskva,Terra-Knizhnyĭ Klub,2000,,"3 volumes in 2, 23 cm",,YA.2002.a.27657,"Julian, Emperor of Rome, 331-363--Fiction ; Leonardo, da Vinci, 1452-1519--Fiction ; Peter--I, Emperor of Russia, 1672-1725--Fiction ; Alexis, son of Peter I, Emperor of Russia, Czarevitch, 1690-1718--Fiction",Fiction,Russian,,
6701604,Monograph,Language material ; Text,Volume,,,,"Leonardo, da Vinci",1452-1519,person,,"Leonardo, da Vinci, 1452-1519 [person] ; Reti, Ladislao [person]","De codices Madrid. Biblioteca Nacional, Madrid","Spain. Biblioteca Nacional. MSS 8936, 8937 ; Tratados varios de fortificacion estatica y geometria",,,Netherlands,Utrecht,Spectrum,1974,,"5 d, 24 cm",,MS.Facs:856 (1-5),,,English ; Italian,In slip-case,
6731435,Monograph,Language material ; Text,Volume,GB7609278,,9.7806E+12,"Monk, C. H.",,person,,"Leonardo, da Vinci, 1452-1519 [person] ; Monk, C. H. [person]",Leonardo da Vinci,,,,England,London,Hamlyn,1975,,"96 pages, illustrations (chiefly colour), 30 cm",709.24,LR.425/75 ; f76/25088,"Leonardo, da Vinci, 1452-1519 ; Italian visual arts--Leonardo--da Vinci--Biographies",,English,Includes index,
6746670,Monograph,Language material ; Text,Volume,GBA116222,,9.78186E+12,"Kliger, Mira",,person,,"Leonardo, da Vinci, 1452-1519 [person] ; Kliger, Mira [person]","Leonardo's studio : a portfolio of his life, his work, his words and a pop-up studio",,,,England,London,Bellew,1999,,"1 volume (16 pages), illustrations (some colour), 14 x 16 cm ; 1 volume (16 pages), illustrations, colour portraits, 28 cm ; 2 press-out cards, colour illustrations, 29 cm ; 3 press-out cards, colour illustrations, approximately 33 cm",759.5,Cup.937/775,"Leonardo, da Vinci, 1452-1519--Catalogs--Juvenile literature ; Painters--Italy--Biography--Juvenile literature ; Leonardo, da Vinci, 1452-1519--Juvenile literature ; Creative activities and seat work",Biography ; Catalogue ; Children's literature,English,Pack title,
6788129,Monograph,Language material ; Text,Volume,,,,"Chamberlain, Houston Stewart",1855-1927,person,,"Chamberlain, Houston Stewart, 1855-1927 [person]","Immanuel Kant : a Study with a Comparison with Goethe, Leonardo da Vinci, Bruno, Plato & Descartes",,,,,,Lane,1914,,2 volumes,193.2,W1/1799,,,English,,
6788130,Monograph,Language material ; Text,Volume,,,,"Chamberlain, Houston Stewart",1855-1927,person,,"Chamberlain, Houston Stewart, 1855-1927 [person]","Immanuel Kant : a Study with a Comparison with Goethe, Leonardo da Vinci, Bruno, Plato and Descartes",,,,,,Lane,1914,,2 volumes,193.2,W193.2,,,English,,
6799575,Monograph,Language material ; Text,Volume,,,,"Leonardo, da Vinci",1452-1519,person,,"Leonardo, da Vinci, 1452-1519 [person] ; Clark, Kenneth, 1903-1983 [person]",A catalogue of the drawings of Leonardo da Vinci : in the collection of His Majesty the King at Windsor Castle,,,,England,Cambridge,Cambridge University Press,1935,,2 volumes,741.945,q741.945 *741*,,,English,,
6799576,Monograph,Language material ; Text,Volume,,,,"Leonardo, da Vinci",1452-1519,person,,"Leonardo, da Vinci, 1452-1519 [person] ; Comitato Nazionale [organisation] ; Tursini, Luigi [person]",Onoranze A Leonardo Da Vinci Nel Quinto Centenario Della Nascita,,,,,,Mostra Della Scienza E Tecnica Di Leonardo,,,,,F4/5700,,,Italian,,
6799577,Monograph,Language material ; Text,Volume,,,,"Leonardo, da Vinci",1452-1519,person,,"Leonardo, da Vinci, 1452-1519 [person] ; Bazardi, Alessandro [person] ; Comitato Nazionale [organisation]",Onoranze A Leonardo Da Vinci Nel Quinto Centenario Della Nascita,,,,,,Mostra Della Scienza E Tecnica Di Leonardo,,,,,F4/5701,,,Italian,,
6799578,Monograph,Language material ; Text,Volume,,,,"Leonardo, da Vinci",1452-1519,person,,"Gianotti, Agostino [person] ; Leonardo, da Vinci, 1452-1519 [person]",Onoranze a Leonardo da Vinci nel quinto centenario della nascita,,,,Italy,Milan,Museo Nazionale Della Scienza E Della Tecnica,,,,,F8/1517,,,Italian,,
6799579,Monograph,Language material ; Text,Volume,,,,"Leonardo, da Vinci",1452-1519,person,,"Leonardo, da Vinci, 1452-1519 [person] ; Castelfranco, Giorgio [person]",Onoranze a Leonardo Da Vinci Nel Quinto Centenario Della Nascita,,,,Italy,Milano,Mostra Della Scienza E Tecnica Di Leonardo,,,,,F14/4483,,,Italian,,
6799580,Monograph,Language material ; Text,Volume,,,,"Leonardo, da Vinci",1452-1519,person,,"Leonardo, da Vinci, 1452-1519 [person]",Trattato Della Pittura,,Scrittori Italiani E Stranieri,,,,Carabba Editore Lanciano,,,,,F5/7787 ; F5/7788,,,Italian,,
6799581,Monograph,Language material ; Text,Volume,,,,"Leonardo, da Vinci",1452-1519,person,,"Leonardo, da Vinci, 1452-1519 [person]",Treatise on painting : codex urbinas Latinus 1270,,,,,,,,,,750,750 *1505*,,,English,,
6802763,Monograph,Language material ; Text,Volume,,,,"Merezhkovsky, Dmitry Sergeyevich",1865-1941,person,,"Merezhkovsky, Dmitry Sergeyevich, 1865-1941 [person]",Christ and Antichrist,Khristos I Antikhrist. Voskresshie,,,England,Lond,Constable,1929,,463 pages,,W16/7978 ; W21/5214,,,English,,
6892516,Monograph,Language material ; Text,Volume,GBA3V7813,,9.78081E+12,"Wasserman, Jack",1921-,person,,"Wasserman, Jack, 1921- [person]",Leonardo,,Masters of art,,England ; United States of America,London ; New York,Harry N. Abrams,2003,,"128 pages, illustrations (some colour), 21 cm",759.5,,"Leonardo, da Vinci, 1452-1519--Criticism and interpretation",,English,,
6907578,Monograph,Language material ; Text,Volume,GBA3Z6951,,9.78071E+12,"Anholt, Laurence",,person,,"Anholt, Laurence [person]",Leonardo and the flying boy : a story about Leonardo da Vinci,,,,England,London,Frances Lincoln,2003,,"32 pages, colour illustrations, 29 cm",823.914,YK.2005.b.4960,"Flight--Juvenile fiction ; Flying-machines--Fiction ; Leonardo, da Vinci, 1452-1519--Juvenile fiction",Children's fiction ; Fiction,English,Originally published: 2000,
6912868,Monograph,Language material ; Text,Volume,GBA3Z8439,,9.78088E+12,"O'Connor, Barbara",,person,,"O'Connor, Barbara [person]",Leonardo da Vinci : Renaissance genius,,,,England ; United States of America,"London ; Minneapolis, Minnesota",Carolrhoda ; Turnaround,2003,,"112 pages, illustrations (some colour), 24 cm",709.2,,"Painting, Italian ; Art appreciation ; Leonardo, da Vinci, 1452-1519--Juvenile literature ; Artists--Italy--Biography--Juvenile literature",Biography ; Children's literature,English,,
6944565,Monograph,Language material ; Text,Volume,GBA4Z9982,,9.78001E+12,"Gelb, Michael",,person,,"Gelb, Michael [person]",How to think like Leonardo da Vinci : seven steps to every day genius,,,,England,London,Thorsons,2004,New edition,"xviii, 318 pages, illustrations, portraits, 22 cm",153.35,YK.2005.a.10224,"Creative thinking ; Creation (Literary, artistic, etc.)",,English,Previous edition: 1998,
6946635,Monograph,Language material ; Text,Volume,GBB325649,,9.78185E+12,"Brown, Dan",1964-,person,,"Brown, Dan, 1964- [person]",The Da Vinci code,,Clipper large print ; Clipper thriller,,England,Leicester,W.F. Howes,2004,Large print edition,"707 pages (large print), 25 cm",813.54,LT.2013.x.3835,"Cryptographers--Fiction ; Secret societies--Fiction ; Art museum curators--Crimes against--Fiction ; Leonardo, da Vinci, 1452-1519--Fiction ; Grail--Fiction ; Large type books ; Paris (France)--Fiction",Fiction ; Mystery fiction,English,"Standard print edition originally published : New York : Doubleday ; London : Bantam, 2003",
6972693,Monograph,Language material ; Text,Volume,GB5006353,,,"Leonardo, da Vinci",1452-1519,person,,"Leonardo, da Vinci, 1452-1519 [person]",Leonardo da Vinci,,Hyperion miniatu es series,,United Kingdom,,Hyperion,1950,,"47 pages, illustrations, 17 cm",759.5,,,,English,,
6980169,Monograph,Language material ; Text,Volume,GB5101432,,,"Leonardo, da Vinci",1452-1519,person,,"Leonardo, da Vinci, 1452-1519 [person]","Leonardo da Vinci, Florentine school",,,,United Kingdom,,Medici Society,1951,,"11 pages, illustrations, 25 cm",759.5,,,,English,,
6997312,Monograph,Language material ; Text,Volume,GB6305304,,,"Almedingen, E. M. (Edith Martha)",,person,,"Almedingen, E. M. (Edith Martha) [person]",The young Leonardo da Vinci,,Famous childhoods series,,United Kingdom,,Parrish,1963,,"143 pages, illustrations, 21 cm",823.91,,,,English,,
6999451,Monograph,Language material ; Text,Volume,GB6307917,,,"Freud, Sigmund",1856-1939,person,,"Freud, Sigmund, 1856-1939 [person]",Leonardo da Vinci and a memory of his childhood,,Pelican books,,United Kingdom,,Penguin,1963,,"192 pages, illustrations, 18 cm",759.5,,,,English,"This translation originally published in the Standard edition of the Complete psychological works of Sigmund Freud, volume11. Routledge & K. Paul, 1957",
7000260,Monograph,Language material ; Text,Volume,GB6308910,,,"Hart, Ivor Blashka",,person,,"Hart, Ivor Blashka [person]",The mechanical investigations of Leonardo da Vinci,,,,United Kingdom,,California University Press ; Cambridge University Press,1963,2nd edition revised and enlarged,"240 pages, illustrations, 21 cm",531.0924,,,,English,Previous edition 1925,
7004094,Monograph,Language material ; Text,Volume,GB6313545,,,"Gillette, Henry Sampson",,person,,"Gillette, Henry Sampson [person]","Leonardo da Vinci, pathfinder of science",,Immortals of science series,,United Kingdom,,Chatto & Windus,1963,,"168 pages, illustrations, 21 cm",509.24,,,,English,"For children. Originally published, F. Watts, 1962",
7008985,Monograph,Language material ; Text,Volume,GB7331681,,9.78E+12,"Leonardo, da Vinci",1452-1519,person,,"Mazza, Adriana Saviozzi [person] ; Leonardo, da Vinci, 1452-1519 [person] ; Nardini, Bruno [person]",Fables of Leonardo da Vinci,Favole e leggende,,,Scotland,Glasgow,Collins,1973,,"4-127 pages, illustrations (chiefly colour), facsimiles, 29 cm",853.2,,"Fables, Italian ; Short stories in Italian, 1375-1492--English texts",,English,"Translation of 'Favole e leggende'. Firenze [Florence] : Centro Internazionale deel Libro, 1972 ; facsimiles on lining papers",
7014740,Monograph,Language material ; Text,Volume,GB7507682,,9780070371941 ; 9780070372078,"Leonardo, da Vinci",1452-1519,person,,"Marinoni, Augusto [person] ; Leonardo, da Vinci, 1452-1519 [person] ; Reti, Ladislao [person]",The Madrid codices [of] Leonardo da Vinci,Biblioteca Nacional (Madrid. Manuscript (8936-7)),,,England ; United States of America,London ; New York,McGraw-Hill,1974,,"5 volumes, illustrations, 24 cm",531.09024,,"Mechanics--Early works to 1800 ; Mechanics, ca 1500--Italian texts--Facsimiles",,English ; Italian,"facsimiles of the manuscript in mirror writing (Biblioteca Nacional, Madrid, 8936 and 8937), transcription of the Italian text with parallel English translation, and English commentary. - In slip case",
7017310,Monograph,Language material ; Text,Volume,GB7428289,,9.78009E+12,"Reti, Ladislao",,person,,"Reti, Ladislao [person]",The unknown Leonardo,,,,England,London,Hutchinson,1974,,"319 pages, illustrations (some colour), facsimiles, maps (chiefly colour), portraits, 33 cm",709.24,,"Leonardo, da Vinci, 1452-1519 ; Italian visual arts--Leonardo--da Vinci--Critical studies ; Madrid--Biblioteca Nacional",,English,Includes index,
7040921,Monograph,Language material ; Text,Volume,GBA2Y9571,,9780711219281 ; 9780711219717,"Anholt, Laurence",,person,,"Anholt, Laurence [person]",Leonardo and the flying boy : a story about Leonardo da Vinci,,,,England,London,Frances Lincoln,2002,,"1 volume, illustrations, 14 cm",823.914,,"Flying-machines--Juvenile fiction ; Leonardo, da Vinci, 1452-1519--Juvenile fiction",Children's fiction,English,Originally published: 2000,
7053870,Monograph,Language material ; Text,Computer disc,GBA275967,,9781842168011 ; 9781842168028,"Meara, P. M. (Paul M.)",,person,,"Lorenzo-Dus, Nuria [person] ; Leonardo da Vinci (Program) [organisation] ; Meara, P. M. (Paul M.) [person] ; Milton, James, 1955- [person]",Language aptitude tests : lognostics,,,,England,Newbury,Express,2001,,"1 computer optical disc, 4 3/4 in + 1 manual (26 pages, 30 cm)",,,Language and languages--Ability testing,,English,"Disc accompanied by a manual containing instructions, statistical data and background information ; Produced with the aid of the Leonardo da Vinci programme of the European Commission ; System requirements: PC with CD drive; Windows 95/98 (will not run on Windows 3.1 or NT) ; Title from disc label",
7078863,Monograph,Language material ; Text,Volume,GBA1X5793,,9.78075E+12,"Nuland, Sherwin B.",,person,,"Nuland, Sherwin B. [person]",Leonardo da Vinci,,,,England,London,Phoenix,2001,,"176 pages, facsimiles, 20 cm",709.2,,"Leonardo, da Vinci, 1452-1519 ; Artists--Italy--Biography",Biography,English,"Originally published: London: Weidenfeld & Nicolson, 2000",
7079220,Monograph,Language material ; Text,Volume,GBA1Y2991,,9.78189E+12,"Steinberg, Leo",,person,,"Steinberg, Leo [person]",Leonardo's incessant last supper,,,,England ; United States of America,London ; New York,Zone,2001,,"312 pages, illustrations (some colour), 27 cm",759.5,,"Leonardo, da Vinci, 1452-1519",,English,,
7093048,Monograph,Language material ; Text,Volume,,,9.78014E+12,"Freud, Sigmund",1856-1939,person,,"Dickson, Albert [person] ; Freud, Sigmund, 1856-1939 [person]","Art and literature : Jensen's Gradiva, Leonardo da Vinci and other works",,The Pelican Freud library,volume 14 [The Pelican Freud library],England,Harmondsworth,Penguin,1985,,,,87/00302,,,English,,
7130996,Monograph,Language material ; Text,Volume,,,9.78928E+12,,,,,European Commission [organisation],Leonardo da Vinci : multilingualism in vocational training,,,,Belgium,,European Commission,1998,,,,OP-EC/4991,,,English,,
7150448,Monograph,Language material ; Text,Volume,,,9.78929E+12,,,,,"European Commission, Directorate-General for Education and Culture [organisation] ; Office for Official Publications of the European Communities [organisation]",Social and occupational integration,,Leonardo da Vinci series Good practices,6 [Leonardo da Vinci series Good practices],Luxembourg,,European Communities ; Office for Official Publications,2003,,"13 pages, illustrations (some colour), 1 colour portraits, 30 cm",370.1130869,EU370.11308694094 ; m02/19488,,,English,Catalogue number NC4101842ENC ; Title from cover,
7214526,Monograph,Language material ; Text,Volume,,,9.78285E+12,"Arasse, Daniel",1944-,person,,"Centre national du livre (France) [organisation] ; Arasse, Daniel, 1944- [person]",Léonard de Vinci : le rythme du monde,,,,France,Paris,Hazan,2003,,"543 pages, illustrations (some colour), portraits (some colour), 32 cm",,LF.31.b.193,"Leonardo, da Vinci, 1452-1519--Criticism and interpretation",,French,'Cet ouvrage a été publié avec le concours du Centre national du livre' - facing t.p,
7222586,Monograph,Language material ; Text,Volume,,,9.78052E+12,"Venezia, Mike",,person,,"Venezia, Mike [person]",Da Vinci,,,,United States of America,,Children's Press,1989,,32 pages,709.24 ; 92,YK.1993.b.1882,"Painting--Appreciation--Juvenile literature ; Painting, Italian ; Paintings ; Leonardo, da Vinci, 1452-1519--Juvenile literature ; Art appreciation ; Italy ; Artists",,English,,
7271835,Monograph,Language material ; Text,Volume,,,,"Patri, Purnendu",,person,,"Patri, Purnendu [person]",Monālisā,,,,India,Kalakātā,Pratikshaṇa Pābalikeśansa,1986,,"80 pages, illustrations",,Ben D 11234,"Leonardo, da Vinci, 1452-1519 ; Art appreciation",,Bengali ; English,,
