11950890,Monograph,Language material ; Text,Volume,GB8136101,,9.78038E+12,"Leonardo da Vinci, the Codex Hammer (Exhibition), London, England",1981,meeting/conference,,"Leonardo da Vinci, the Codex Hammer (Exhibition), London, England, 1981 [meeting/conference] ; Roberts, Jane, 1949- [person] ; Royal Academy of Arts (Great Britain) [organisation]","Leonardo da Vinci, the Codex Hammer : formerly the Codex Leicester : [exhibition at the Royal Academy of Arts, 1981]",,,,England,London,Royal Academy of Arts,1981,,"126 pages, illustrations, facsimiles, 28 cm",500,X.425/3889,"Leonardo, da Vinci, 1452-1519 ; Science--Leonardo--da Vinci--Catalogues",,English,In slip case with: Leonardo da Vinci nature studies from the Royal Library at Windsor Castle / catalogue by Carlo Pedretti,
11950891,Monograph,Language material ; Text,Volume,GB8136100,,9.78038E+12,"Pedretti, Carlo",,person,,"Royal Library (Windsor Castle) [organisation] ; Leonardo, da Vinci, 1452-1519 [person] ; Pedretti, Carlo [person] ; Royal Academy of Arts (Great Britain) [organisation]",Leonardo da Vinci nature studies from the Royal Library at Windsor Castle,,,,England,London,Royal Academy of Arts,1981,,"95 pages, illustrations, facsimiles, 28 cm",741.945,X.425/3890,"Leonardo, da Vinci, 1452-1519--Exhibitions ; Landscape in art--Exhibitions ; London--Westminster (London Borough)--Art galleries--Royal Academy of Arts--Exhibits--Italian drawings by Leonardo--da Vinci--from Windsor Castle--Royal Library--Catalogues ; Royal Library (Windsor Castle)--Catalogs ; Nature (Aesthetics)--Exhibitions",,English,"In slip case with: Leonardo da Vinci, the Codex Hammer, formerly the Codex Leicester / catalogue by Jane Roberts",
11955861,Monograph,Language material ; Text,Volume,,,9.7804E+12,"Goldstein, Thomas",,person,,"Goldstein, Thomas [person]",Dawn of modern science : from the Arabs to Leonardo Da Vinci,,,,United States of America,"Boston, Massachusetts",Houghton Mifflin,1980,,"xvii, 297 pages, illustrations, maps, 24 cm",509.024,80/12078 ; X.622/12306,"Science, Renaissance ; Science--to date",,English,,
11973826,Monograph,Language material ; Text,Volume,GB9853958,,9.78068E+12,"Masters, Roger D.",,person,,"Masters, Roger D. [person]",Fortune is a river : Leonardo da Vinci and Niccolò Machiavelli's magnificent dream to change the course of Florentine history,,,,England ; United States of America,London ; New York,Free Press,1998,,"278 pages, 8 pages of plates, illustrations, maps, portraits, 25 cm",945.51,98/19796 ; YC.2001.a.20909,"Water diversion--Italy--Arno River--History ; Leonardo, da Vinci, 1452-1519 ; Diversion structures (Hydraulic engineering)--Italy--Arno River--History ; Machiavelli, Niccolò, 1469-1527 ; Florence (Italy)--History--1421-1737",,English,Includes index,
11978128,Monograph,Language material ; Text,Volume,GBA165004,,9780691090573 ; 9780894682858,,,,,"National Gallery of Art (U.S.) [organisation] ; Brown, David Alan, 1942- [person]",Virtue & beauty : Leonardo's Ginevra de' Benci and Renaissance portraits of women,,,,England,"Oxford ; Washington, District of Columbia",National Gallery of Art ; Princeton University Press,2001,,"236 pages, illustrations (some colour), portraits (some colour), 34 cm",757.4094551,LB.31.c.12406,"Leonardo, da Vinci, 1452-1519--Exhibitions ; Women in art--Exhibitions ; Portraits, Italian--Italy--Florence--Exhibitions ; Women--Portraits--Exhibitions ; Portraits, Renaissance--Italy--Florence--Exhibitions",Exhibition,English,"Catalogue of an exhibition held September 30, 2001-Jan. 6, 2002 at the National Gallery of Art",
11987517,Monograph,Language material ; Text,Volume,GB7930214,,9.78071E+12,"Sachs, Marianne",,person,,"Sachs, Marianne [person]",Leonardo and his world,,Great masters ; The kingfisher library,,England,London,Ward Lock,1979,,32 pages,709.24,X.423/10869,"Italian visual arts--Leonardo--da Vinci--Biographies ; Artists--Italy--Biography--Juvenile literature ; Leonardo, da Vinci, 1452-1519--Juvenile literature",,English,bibliography: p.29. _ Includes index ; colour illustrations on lining papers,
12033797,Monograph,Language material ; Text,Volume,GB9009844,,9.78185E+12,,,,,South Bank Centre [organisation] ; Hayward Gallery [organisation],"Leonardo da Vinci : Hayward Gallery, London : 26 January to 16 April 1989",,,,England,London,South Bank Centre,1989,,"246 pages, illustrations (some colour), facsimiles (some colour), 28 cm",760.092,LB.31.b.4254,"Leonardo, da Vinci, 1452-1519 ; Italian graphic arts--Leonardo--da Vinci, 1452-1519",,English,,
12055148,Monograph,Language material ; Text,Volume,,,9.78342E+12,"Veltman, Kim H.",,person,,"Veltman, Kim H. [person] ; Keele, Kenneth D. (Kenneth David) [person]",Linear perspective and the visual dimensions of science and art,,Studies on Leonardo da Vinci,1 [Studies on Leonardo da Vinci],Germany,München,Deutscher Kunstverlag,1986,,"534 pages, illustrations",709.24,YV.1989.b.893,"Leonardo, da Vinci, 1452-1519--Criticism and interpretation ; Perspective ; Art and science ; Italian graphic arts--Leonardo--da Vinci, 1452-1519 ; Visual perception",,English,,
12070609,Monograph,Language material ; Text,Volume,GBA2U8554,,9.78888E+12,"Niccoli, R. (Riccardo)",,person,,"Niccoli, R. (Riccardo) [person]",History of flight : from the flying machine of Leonardo Da Vinci to the conquest of space,,,,England ; Italy,Maidstone ; Vercelli,Amalgamated Book Services ; White Star,2002,,"319 pages, illustrations (some colour), portraits (some colour), 36 cm",629.1309,LB.31.c.14211,Aeronautics--History,,English,,
12070707,Monograph,Language material ; Text,Volume,,,9.78888E+12,,,,,"Carminati, Marco [person] ; Bora, Giulio [person] ; Brown, David Alan, 1942- [person]",I leonardeschi : l'eredità di Leonardo in Lombardia,,,,Italy,Milano,Skira,1998,,"414 pages, illustrations (some colour), 29 cm",,LB.31.b.19407,"Leonardo da Vinci school ; Painting, Italian--Italy--Lombardy ; Leonardo, da Vinci, 1452-1519--Influence ; Painting, Renaissance--Italy--Lombardy",,Italian,,
12070708,Monograph,Language material ; Text,Volume,GBA035896,,9.78888E+12,,,,,"Carminati, Marco [person] ; Bora, Giulio [person] ; Brown, David Alan, 1942- [person]",The legacy of Leonardo : painters in Lombardy 1490-1530,,,,Italy,Milan,Skira,1998,,"414 pages, illustrations (some colour), 29 cm",759.5,LB.31.b.27350 ; m02/15658,"Painting, Renaissance--Italy--Lombardy ; Painting, Italian ; Leonardo, da Vinci, 1452-1519--Influence ; Leonardo, da Vinci, 1452-1519--Disciples",,English,,
12070832,Monograph,Language material ; Text,Volume,,,9.78888E+12,,,,,"Italy, Ministero per i beni culturali e ambientali [organisation] ; Palazzo Pitti [organisation] ; Bull, David, 1934- [person] ; Palazzo del Quirinale (Rome, Italy) [organisation] ; Marani, Pietro C. [person] ; Pinacoteca di Brera [organisation] ; Fabjan, Barbara [person]",Leonardo : la Dama con l'ermellino,,,,Italy,Cinisello Balsamo ; Milano,Silvana,1998,,"95 pages, illustrations (some colour), 28 cm",,LB.31.b.19036,"Leonardo, da Vinci, 1452-1519--Exhibitions ; Muzeum Narodowe w Krakowie--Zbiory Czartoryskich--Exhibitions ; Portraits, Renaissance--Italy ; Gallerani, Cecilia, 1473---Portraits--Exhibitions",Exhibition,Italian,"Catalog of an exhibition held at Palazzo deel Quirinale, Rome, October 15-Nov. 14, 1998; Pinacoteca di Brera, Milan, November 19-Dec. 13, 1998; and Palazzo Pitti, Florence, December 16, 1998-Jan. 24, 1999; sponsored by Ministero per i beni culturali e ambientali",
12073455,Monograph,Language material ; Text,Volume,,,9.789E+12,"Farago, Claire J.",,person,,"Farago, Claire J. [person]",Leonardo da Vinci's Paragone : a critical interpretation with a new edition of the text in the Codex Urbinas,Bibliotheca apostolica vaticana. Manuscript. Codex Vaticanas Urbinas 1270,Brill's studies in intellectual history,volume 25 [Brill's studies in intellectual history],Netherlands,Leiden,Brill,1992,,472 pages,750,YA.1993.b.9558,"Leonardo, da Vinci, 1452-1519 ; Ut pictura poesis (Aesthetics) ; Painting--Philosophy ; Italian paintings--Leonardo--da Vinci, 1452-1519",,English,,
12078571,Monograph,Language material ; Text,Volume,,,9.78902E+12,Sophocles,,person,,"Leonardo, da Vinci, 1452-1519 [person] ; Mulisch, Harry, 1927-2010 [person] ; Sophocles [person]",Oidipous Oidipous,Oedipus Coloneus ; Oedipus Rex. Dutch,,,Netherlands,Amsterdam,Bezige Bij,1972,,"151 pages, 21 x 33 cm",,L:49/618,,,Dutch,'Geënt op ... Sofokles: Koning Oidipous en Oidipous in Kolonos',
12163118,Monograph,Language material ; Text,Volume,,,,"Ucelli, Guido",,person,,"Ucelli, Guido [person]",Programma e Idealita Del Museo Nazionale Della Scienza E Della Tecnica 'Leonardo Da Vinci' : Le Istituzioni Analoghe in Italia E All'Estero,,Onoranze A Leonardo Da Vinci Nel Quinto Centenario Della Nascita Comitato Nazionale,9 [Onoranze A Leonardo Da Vinci Nel Quinto Centenario Della Nascita Comitato Nazionale],Italy,Milano,Mostra Della Scienza E Technica Di Leonardo,,,,,X8/2240,,,Italian,,
12164796,Monograph,Language material ; Text,Volume,,,,"Vallentin, Antonina",,person,,"Vallentin, Antonina [person]",Leonardo da Vinci : the tragic pursuit of perfection,,,,,,Gollancz,1939,,,920,W21/3769,,,English,,
12164797,Monograph,Language material ; Text,Volume,,,,"Vallentin, Antonina",,person,,"Vallentin, Antonina [person]",Leonardo da Vinci : the tragic pursuit of perfection,,,,,,Gollancz,1939,,,,B *702*,,,English,,
12164798,Monograph,Language material ; Text,Volume,,,,"Vallentin, Antonina",,person,,"Vallentin, Antonina [person]",Leonardo da Vinci : the tragic pursuit of perfection,,,,,,Gollancz,1939,,,,B *1047* ; W9/3696,,,English,,
12164879,Monograph,Language material ; Text,Volume,,,,"Valéry, Paul",1871-1945,person,,"Valéry, Paul, 1871-1945 [person]",Introduction to the method of Leonardo da Vinci,,,,,,Rodker,1929,,,,qB *9*,,,English,,
12220025,Monograph,Language material ; Text,Volume,GB6122104,,,"Baroni, Constantino",,person,,"Baroni, Constantino [person]",All the paintings of Leonardo da Vinci,,Complete library of world art,volumes 2 [Complete library of world art],United Kingdom,,Oldbourne,1961,,"60 pages, illustrations, 19 cm",759.5,,,,English,,
12220188,Monograph,Language material ; Text,Volume,GB6122311,,,"Hart, Ivor Blashka",,person,,"Hart, Ivor Blashka [person]","The world of Leonardo da Vinci, man of science, engineer and dreamer of flight",,,,United Kingdom,,Macdonald,1961,,"374 pages, illustrations, 25 cm",509.24,,,,English,,
12224971,Monograph,Language material ; Text,Volume,GB6205259,,,"Eissler, K. R. (Kurt Robert)",1908-1999,person,,"Eissler, K. R. (Kurt Robert), 1908-1999 [person]",Leonardo da Vinci : psychoanalytic notes on the enigma,,International psycho,analytical library;numbers 58 [International psycho],United Kingdom,,Hogarth ; Institute of Psycho-Analysis,1962,,"375 pages, illustrations, 26 cm",759.5,4545.34,,,English,,
12226273,Monograph,Language material ; Text,Volume,GB6206836,,,,,,,,"Leonardo da Vinci, Florentine school",,,,United Kingdom,,Medici Society,1962,Revised edition,"16 pages, illustrations, 26 cm",759.5,,,,English,Previous edition (B50-1432) 1950,
12231172,Monograph,Language material ; Text,Volume,GB7023256,,9.78071E+12,"Leonardo, da Vinci",1452-1519,person,,"Leonardo, da Vinci, 1452-1519 [person] ; Richter, Jean Paul [person]",The literary works of Leonardo da Vinci; compiled & edited from the original manuscripts by Jean Paul Richter; in two volumes. 3rd ed. Vol.1,,,,England,London,Phaidon,1970,,"xxix, 395 pages, 61 plates, illustrations, facsimiles, 26 cm",709,,,,English,"Parallel Italian text, English translation ; Previous edition, London: Oxford U.P, 1939",
12231173,Monograph,Language material ; Text,Volume,GB7011346,,9.78071E+12,"Leonardo, da Vinci",1452-1519,person,,"Leonardo, da Vinci, 1452-1519 [person] ; Richter, Jean Paul [person]",The literary works of Leonardo da Vinci; compiled and edited from the original manuscripts by Jean Paul Richter; in two volumes. 3rd ed. Vol.2,,,,England,London,Phaidon,1970,,"xi, 458 pages, 64 plates, illustrations, facsimiles, 26 cm",858.208,,,,English,"Parallel Italian text, English translation",
12283938,Monograph,Language material ; Text,Volume,GBA4Y2975,,9.78159E+12,"Atalay, Bülent",,person,,"Atalay, Bülent [person]",Math and the Mona Lisa : the art and science of Leonardo da Vinci,,,,United States of America,"Chesham ; Washington, District of Columbia",Combined Academic ; Smithsonian Institution,2004,,"xix, 314 pages, 16 pages of plates, illustrations (some colour), portraits (some colour), 21 cm",709.2,m04/25917,"Leonardo, da Vinci, 1452-1519--Criticism and interpretation ; Art and science",,English,,
12312227,Monograph,Language material ; Text,Volume,GBA0V5896,,9.78186E+12,"Leonardo, da Vinci",1452-1519,person,,"Leonardo, da Vinci, 1452-1519 [person] ; Desmond, Michael [person] ; Pedretti, Carlo [person]",Leonardo da Vinci : the Codex Leicester,,,,Australia ; Wales,"Aldershot ; Sydney, New South",Lund Humphries ; Powerhouse,2001,,"160 pages, 28 cm",627,,"Leonardo, da Vinci, 1452-1519 ; Hydraulics--Early works to 1800 ; Hydrodynamics--Early works to 1800",,English,,
12314357,Monograph,Language material ; Text,Volume,,,9.78038E+12,"Leonardo, da Vinci",1452-1519,person,,"Leonardo, da Vinci, 1452-1519 [person]",Leonardo Da Vinci Nature studies from the Royal Library At Windsor Castle,Leonardo - Nature Studies,,,,,Johnson Reprint Corporation,1980,,,,81/13371,,,English,,
12324538,Monograph,Language material ; Text,Volume,,,9.78085E+12,"Pedretti, Carlo",,person,,"Pedretti, Carlo [person]","Leonardo, architect",,,,United States of America,New York,Rizzoli,1985,,,720.924,86/18186,"Leonardo, da Vinci, 1452-1519--Criticism and interpretation ; Architecture, Renaissance--Italy",,English,,
12327433,Monograph,Language material ; Text,Volume,,,9.78038E+12,"Leonardo, da Vinci",1452-1519,person,,"Roberts, Jane, 1949- [person] ; Leonardo, da Vinci, 1452-1519 [person] ; Pedretti, Carlo [person] ; Windsor Castle, Royal Library [organisation] ; National Gallery of Art (U.S.) [organisation]",Leonardo da Vinci : drawings of horses and other animals from the Royal Library at Windsor Castle,Drawings of horses and other animals from the Royal Library at Windsor Castle,,,United States of America,New York,Johnson Reprint Corporation,1984,,,,85/20583,,,English,,
12328239,Monograph,Language material ; Text,Volume,,,9780002721547 ; 9780002721561,,,,,"Roberts, Jane, 1949- [person] ; Queen's Gallery (London, England) [organisation] ; Hughes-Onslow, Olivia [person]",Master drawings from the Royal Collection : from Leonardo da Vinci to the present day,,,,England,London,Collins Harvill,1985,,,,GPB-7086,,,English,,
12367816,Monograph,Language material ; Text,Volume,,,9.78928E+12,,,,,European Commission [organisation],Leonardo da Vinci : vocational training : a precondition for technological and organisational change,,,,Luxembourg,,European Commission,1998,,,331.2592,EU331.2592 ; OP-EC/4812,,,English,,
12367817,Monograph,Language material ; Text,Volume,,,9.78928E+12,,,,,European Commission [organisation],Survey and analysis projects in the Leonardo da Vinci programme : guidelines for prospective promoters,,,,Luxembourg,,European Commission,1997,,,331.2592094,EU331.2592094 ; OP-EC/4813,,,English,,
12374296,Monograph,Language material ; Text,Volume,,,9.78928E+12,,,,,European Commission [organisation],"Leonardo da Vinci : analysis of the results of studies on vocational training in Europe : findings of the Comett, Eurotecnet, FORCE, Lingua and PETRA programmes",,,,Luxembourg,,European Commission,1998,,,331.2592094,EU331.2592094 ; OP-EC/4890,,,English,,
12386310,Monograph,Language material ; Text,Volume,,,9.78929E+12,,,,,"European Commission, Directorate-General for Education and Culture [organisation]",Distance learning,,Leonardo da Vinci series Good practices,4 [Leonardo da Vinci series Good practices],Luxembourg,,European Commission,2002,,"15 pages, illustrations (some colour), colour portraits, 30 cm",374.4094,EU374.4094 ; m02/35981,,,English,Catalogue number NC4101834ENC ; Title from cover,
12388354,Monograph,Language material ; Text,Online resource,,,,"Barone, Juliana",,person,,"Barone, Juliana [person]",Leonardo da Vinci on motion : seventeenth-century views,,,,,,University of Oxford,2001,,,708,395199,,,,,
12453027,Monograph,Language material ; Text,Volume,,,9.78889E+12,,,,,"Bogliolo, Domenico [person] ; European Council of Information Associations [organisation] ; Associazione italiana per la documentazione avanzata [organisation] ; European Commission [organisation] ; Carosella, Maria Pia [person]",EuroGuida I&D : competenze dei professionisti europei dell'informazione e della documentazione : lavoro realizzato con il supporto della Commissione dell'UE nel quadro del programma 'Leonardo da Vinci',Euroréférentiel I&D. Italian,,,Italy,Fiesole,Casalini libri,2000,,"47 pages, 24 cm",,YA.2003.a.12401,Information science--European Union countries ; Information scientists--Job descriptions--European Union countries,,Italian,,
12457533,Monograph,Language material ; Text,Volume,,,9.78881E+12,"Ames-Lewis, Francis",1943-,person,,"Ames-Lewis, Francis, 1943- [person] ; Biblioteca leonardiana [organisation]",La matita nera nella pratica di disegno di Leonardo da Vinci,,Lettura vinciana,41 st [Lettura vinciana],Italy,Vinci,"Città di Vinci, Biblioteca Leonardiana",2002,,"16, 31 pages of plates, chiefly illustrations, portraits, 29 cm",,YA.2003.b.2030,"Leonardo, da Vinci, 1452-1519 ; Leonardo, da Vinci, 1452-1519--Criticism and interpretation",,Italian,,
12461992,Monograph,Language material ; Text,Volume,,,9.78291E+12,"Khaitzine, Richard",,person,,"Khaitzine, Richard [person]","Histoire, énigme et secrets de la Joconde",,,,France,Grenoble,Mercure dauphinois,2003,,"157 pages, 22 cm",,YA.2003.a.33491,"Leonardo, da Vinci, 1452-1519",,French,,
12465499,Monograph,Language material ; Text,Volume,,,9.78884E+12,,,,,"Biblioteca di S.M. il re (Turin, Italy) [organisation] ; Italy, Ministero per i beni culturali e ambientali [organisation] ; Giacobello Bernard, Giovanna [person] ; Pagella, Enrica [person] ; Fondazione Torino Musei, Museo Civico d'Arte Antica e Palazzo Madama [organisation]","Van Eyck, Antonello, Leonardo : tre capolavori del Rinascimento",,,,Italy,Torino,Allemandi,2003,,"79 pages, illustrations (some colour), 24 cm",,YA.2003.a.42732,"Leonardo, da Vinci, 1452-1519--Exhibitions ; Antonello, da Messina, 1430?-1479--Exhibitions ; Eyck, Jan van, 1390-1440--Exhibitions",Exhibition,Italian,"Catalogue of an exhibition held a the Biblioteca Reale, Torino, 9 marzo 2003 - 7 marzo 2004-verso",
12499806,Monograph,Language material ; Text,Volume,,,,"Maraini, Fosco",,person,,"Cassin, Riccardo [person] ; Maraini, Fosco [person]","Gasherbrum 4, Baltoro, Karakorùm : una spedizione alle montagne del Pakistan organizzata e finanziata nel 1958 dal Club alpino italiano",,,,Italy,Bari,Leonardo da Vinci,1960,,"xix, 334 pages, illustrations (parts colour), maps, 24 cm",,V 14164,Club alpino italiano--1958 ; Mountaineering ; Karakoram Range,,Italian,,
12510399,Monograph,Language material ; Text,Volume,,,9.78951E+12,"Masciángioli, Jorge",1929-,person,,"Masciángioli, Jorge, 1929- [person]",Señor Leonardo : tragedia de los enigmas : dos partes y seis cuadros,,Colección Escritura de hoy,,Argentina,Buenos Aires,Grupo ; Latinoamericano,1992,,"133 pages, 23 cm",,YA.1995.a.12928,"Leonardo, da Vinci, 1452-1519--Fiction",,Spanish,,
12517975,Monograph,Language material ; Text,Volume,,,,"Brown, David Alan",1942-,person,,"Leonardo, da Vinci, 1452-1519 [person] ; Biblioteca leonardiana [organisation] ; Brown, David Alan, 1942- [person]",Madonna Litta,,Lettura vinciana,29 [Lettura vinciana],Italy,Firenze,Giunti Barbèra,1990,,"20 pages, 15 pages of plates, illustrations, 29 cm",,YA.1994.b.7556,"Leonardo, da Vinci, 1452-1519 ; Italian paintings--Leonardo--da Vinci, 1452-1519",,Italian,"'15 aprile 1989.' ; 'Città di Vinci, Biblioteca Leonardiana.'",
12520105,Monograph,Language material ; Text,Volume,,,9.78502E+12,"Rutenburg, V. I. (Viktor Ivanovich)",1911-,person,,"Rutenburg, V. I. (Viktor Ivanovich), 1911- [person]",Titany Vozrozhdenii︠a︡,,Serii︠a︡ 'Iz istorii mirovoĭ kulʹtury',,Russia,Saint Petersburg,"'Nauka,' S-Peterburgskoe otd-nie",1991,2e izdaniye,"151, 3 pages, illustrations, 20 cm",,Ac.1125/434 (65),"Machiavelli, Niccolò, 1469-1527 ; Renaissance--Italy ; Leonardo, da Vinci, 1452-1519 ; Luther, Martin, 1483-1546 ; Dürer, Albrecht, 1471-1528 ; Renaissance--Germany",,Russian,At head of title: Akademii︠a︡ nauk SSSR,
12525074,Monograph,Language material ; Text,Volume,,,9.78884E+12,"Leonardo, da Vinci",1452-1519,person,,"Leonardo, da Vinci, 1452-1519 [person] ; Vecce, Carlo [person]",Scritti,"Works. Selections, 1992",GUM,"nuova serie, 214 [GUM]",Italy,Milano,Mursia,1992,Edition 1,"270 pages, 18 cm",,YA.1994.a.16175,,,Italian,,
12534572,Monograph,Language material ; Text,Volume,,,,"Ponte, Giovanni",,person,,"Ponte, Giovanni [person]",Leonardo prosatore,,,,Italy,Genova,Tilgher,1976,,"133 pages, 24 cm",,X.900/20108,"Prose in Italian--Leonardo--da Vinci ; Leonardo, da Vinci, 1452-1519",,Italian,,
12536516,Monograph,Language material ; Text,Volume,,,,"Lebel, Robert",,person,,"Lebel, Robert [person] ; Ipoustéguy, Jean, 1920-2006 [person]","Léonard de Vinci ; ou, La fin de l'humilité",,,,France,Paris,Le Soleil Noir,1974,,"81 pages, illustrations, 26 cm",,X:410/6482,"Leonardo, da Vinci, 1452-1519",,French,,
12579534,Monograph,Language material ; Text,Volume,,,9.78888E+12,,,,,"Museo nazionale della scienza e della tecnica 'Leonardo da Vinci' [organisation] ; Sutera, Salvatore [person] ; Lini, Domenico [person]",Museo nazionale della scienza e della tecnica Leonardo da Vinci,,Guide Skira,,Italy,Milano,Skira,1997,,"176 pages, colour illustrations, 21 cm",507.44521,YA.2000.a.33337,Science museums--Italy--Firenze--Guidebooks ; Industrial museums--Italy--Firenze--Guidebooks ; Museo nazionale della scienza e della tecnica 'Leonardo da Vinci'--Guidebooks,,Italian,,
12579741,Monograph,Language material ; Text,Volume,,,,"Ferretti, Emanuela",,person,,"Ferretti, Emanuela [person] ; Micheli, Giovanni [person]",Il Palazzo di Cosimo I a Cerreto Guidi : la Villa medicea : dalla fabbrica di Davitte Fortini alla corte di Isabella,,,,Italy,Firenze ; Vinci,Museo ideale Leonardo Da Vinci ; Strumenti-memoria del territorio,1998,,"141 pages, illustrations (some colour), 31 cm + 3 floppy disks",,CDM.2001.b.50,"Villa medicea (Cerreto Guidi, Italy) ; Cosimo--I, Grand-Duke of Tuscany, 1519-1574--Homes and haunts ; Cerreto Guidi (Italy)--Buildings, structures, etc",,Italian,System requirements for accompanying computer disks: PC; Microsoft Windows 3.1 or 95 or later,
12579888,Monograph,Language material ; Text,Volume,,,,"Brambilla Barcilon, Pinin",,person,,"Brambilla Barcilon, Pinin [person] ; Marani, Pietro C. [person] ; Leonardo, da Vinci, 1452-1519 [person]",Leonardo : L'ultima cena,,Dentro la pittura,,Italy,Milano,Electa,1999,,"454 pages, illustrations (some colour), 29 cm",,LB.31.b.19560,"Leonardo, da Vinci, 1452-1519 ; Last Supper in art ; Mural painting and decoration--Conservation and restoration--Italy--Milan",,Italian,,
12582055,Monograph,Language material ; Text,Volume,,,,"Leonardo, da Vinci",1452-1519,person,,"Leonardo, da Vinci, 1452-1519 [person] ; Starnazzi, Carlo [person]",La 'Madonna dei fusi' di Leonardo da Vinci e il paesaggio del Valdarno Superiore,,,,Italy,,,2000,,"64 pages, 10 leaves of plates, illustrations (some colour), 30 cm",,YA.2001.b.1644,"Leonardo, da Vinci, 1452-1519--Exhibitions ; Painting--Private collections--New York (State)--Exhibitions ; Painting, Renaissance--Italy--Florence--Exhibitions",Exhibition,Italian,"Catalog of an exhibition held in Palazzo dei Priori, Arezzo, July 1-Nov. 15, 2000",
12583256,Monograph,Language material ; Text,Volume,,,9.78882E+12,"Pizzagalli, Daniela",,person,,"Pizzagalli, Daniela [person]",La dama con l'ermellino : vita e passioni di Cecilia Gallerani nella Milano di Ludovico il Moro,,,,Italy,Milano,Rizzoli,1999,,"199, 1 page, 23 cm",,YA.2001.a.18751,"Gallerani, Cecilia, 1473- ; Leonardo, da Vinci, 1452-1519 ; Mistresses--Italy--Milan--Biography",Biography,Italian,,
12587101,Monograph,Language material ; Text,Volume,,,9.78272E+12,"Coignard, Jérôme",1957-,person,,"Coignard, Jérôme, 1957- [person]",Loin du Louvre : le vol de la Joconde,On a volé la Joconde,,,France,Paris,Olbia,1998,,"139 pages, 22 cm",,YA.2001.a.26953,"Leonardo, da Vinci, 1452-1519 ; Art thefts--France--Paris ; Musée du Louvre",,French,"Originally published, Paris, 1990 as: On a volé la Joconde",
12587360,Monograph,Language material ; Text,Volume,,,,"Ponte, Giovanni",,person,,"Ponte, Giovanni [person]","Studi sul Rinascimento : Petrarca, Leonardo, Ariosto",,Collana di linguistica e critica letteraria,15 [Collana di linguistica e critica letteraria],Italy,Napoli,Morano,1994,,"325 pages, 21 cm",,YA.2001.a.28864,"Ariosto, Lodovico, 1474-1533 ; Leonardo, da Vinci, 1452-1519 ; Petrarca, Francesco, 1304-1374",,Italian,,
12588120,Monograph,Language material ; Text,Volume,,,9.78881E+12,"Sciolla, Gianni Carlo",,person,,"Leonardo, da Vinci, 1452-1519 [person] ; Sciolla, Gianni Carlo [person]",Leonardo e Pavia,,Lettura vinciana,35 [Lettura vinciana],Italy,Firenze,Giunti,1995,,"32 pages, illustrations, 29 cm",,YA.2001.b.3098,"Leonardo, da Vinci, 1452-1519 ; Pavia (Italy)--Buildings, structures, etc",,Italian,,
12626370,Monograph,Language material ; Text,Volume,GBA041958,,9.78043E+12,"Connolly, Sean",1956-,person,,"Connolly, Sean, 1956- [person]",The life and work of Leonardo da Vinci,Leonardo da Vinci,Heinemann first library,,England,Oxford,Heinemann Library,1999,,"32 pages, illustrations, 23 cm",759.5,YK.2001.a.11092,"Painters--Italy--Biography--Juvenile literature ; Painting, Renaissance--Italy--Juvenile literature ; Leonardo, da Vinci, 1452-1519--Juvenile literature",Biography ; Children's literature,English,,
